排名,ASIN编号,商品名称,品牌,评分,评论数,价格(墨西哥比索),月销量,销量依据,上架时间,在售月数,变体数量,卖家,卖家类型,卖家所在地,卖家详细地址,配送方式,商品链接,完整详情
1,B07DCJ8B3S,Ganador Premium 成犬干粮 15kg,Ganador,4.8,1687,659.0,6000,亚马逊官方(上月购买量),2024-05-09,26,1,Amazon México,亚马逊自营,,,亚马逊自营配送,https://www.amazon.com.mx/dp/B07DCJ8B3S,True
2,B08JSG74RV,Ganador Premium Superfoods 20kg，中型和大型犬成年犬粮,Ganador,4.6,2899,899.0,5000,亚马逊官方(上月购买量),2020-09-22,70,1,Amazon México,亚马逊自营,,,亚马逊自营配送,https://www.amazon.com.mx/dp/B08JSG74RV,True
3,B0CYXKNB1Y,MESVIER 狗胸背带 中大型小型通用 带1.5米牵引绳 可调节反光透气 防拉扯 散步旅行训练 狗狗配件,MESVIER,4.7,9578,249.0,400,亚马逊官方(上月购买量),2024-04-13,27,43,MESVIER,品牌方(中国),中国,中国/518104/广东/宝安区/深圳/民主社区蚝三民主丰泽园5、6、7、8、9栋7栋1402/沙井街道,FBA,https://www.amazon.com.mx/dp/B0CYXKNB1Y,True
4,B0153V4AOM,Nupec 小型犬成年犬粮，含 Omega-3 和 Omega-6，8公斤装,Nupec,4.8,15726,1150.97,8000,亚马逊官方(上月购买量),2015-09-01,131,1,Amazon México,亚马逊自营,,,亚马逊自营配送,https://www.amazon.com.mx/dp/B0153V4AOM,True
5,B00NABTG60,亚马逊倍思 - 狗屎袋，带分配器，黑色，600个（40卷），升级防漏，无香，包括牵引绳夹,,4.9,235361,262.87,,,,,,,,,,,https://www.amazon.com.mx/dp/B00NABTG60,False
6,B01MQFPHMN,胜者Premium成犬粮20公斤，小体型犬，黑色，包装可能不同,,4.7,2584,888.0,,,,,,,,,,,https://www.amazon.com.mx/dp/B01MQFPHMN,False
7,B01N0AG6OF,Ganador Premium幼犬粮20kg，中大型犬种，包装可能有所不同,,4.7,4792,868.0,,,,,,,,,,,https://www.amazon.com.mx/dp/B01N0AG6OF,False
8,B0CXYTC8WM,胜利者干狗粮20kg,,4.7,1699,705.0,,,,,,,,,,,https://www.amazon.com.mx/dp/B0CXYTC8WM,False
9,B0153V49XO,Nupec成年小型犬狗粮，含Omega 3和6，2公斤装,,4.8,8513,362.96,,,,,,,,,,,https://www.amazon.com.mx/dp/B0153V49XO,False
10,B01N30FXOM,普瑞纳冠能小型犬成犬粮牛肉鸡肉味7.5kg,,4.8,4915,336.0,,,,,,,,,,,https://www.amazon.com.mx/dp/B01N30FXOM,False
11,B09R93SSD5,Purina Beneful Adulto Todos los tamaños Salud Radiante Sabor Salmón 10Kg,,4.8,4300,553.0,,,,,,,,,,,https://www.amazon.com.mx/dp/B09R93SSD5,False
12,B018M8AR90,Dry Pet Tapete Entrenador para Perro de 30 Piezas,Dry Pet,4.6,3744,159.81,2000,亚马逊官方(上月购买量),2016-05-06,123,5,Amazon México,亚马逊自营,,,亚马逊自营配送,https://www.amazon.com.mx/dp/B018M8AR90,True
13,B0D43R8KKL,"Fancy Pets MS Aceite de Salmon para Perros y Gatos 250ml - Omega 3 con DHA y EPA - Piel Sana, Pelaje Brillante y Sistema Inmune Fuerte",Medical Solutions,4.5,2034,149.0,1000,亚马逊官方(上月购买量),2024-05-13,26,3,Amazon México,亚马逊自营,,,亚马逊自营配送,https://www.amazon.com.mx/dp/B0D43R8KKL,True
14,B0153V41AU,Nupec Croquetas para Perro Adulto con Omega 3 y 6 - 1 pack x 15 kg,Nupec,4.8,7967,1727.52,4000,亚马逊官方(上月购买量),2015-09-01,131,1,Amazon México,亚马逊自营,,,亚马逊自营配送,https://www.amazon.com.mx/dp/B0153V41AU,True
15,B0153V7ZTO,Purina Dog Chow Adulto Raza Medina y Grande Sabor Carne y Pollo 7.5Kg,Dog Chow,4.8,4115,336.0,2000,亚马逊官方(上月购买量),2016-11-24,116,1,Amazon México,亚马逊自营,,,亚马逊自营配送,https://www.amazon.com.mx/dp/B0153V7ZTO,True
16,B0CF63JSS9,Dogelthy Pure Salmon Oil 450 ml. Aceite de Salmon Omega 3 para Perro con 300 MG de EPA + DHA por Dosis. Suplemento de Aceite de Pescado para Perro. para Croquetas o Dieta Barf.,Dogelthy,4.7,3030,509.0,1000,亚马逊官方(上月购买量),2023-08-09,35,3,Dogelthy,品牌方(墨西哥),墨西哥,MX/45019/JALISCO/Zapopan/San Juan de Ocotan/5 de Mayo #15 Interior 6,FBA,https://www.amazon.com.mx/dp/B0CF63JSS9,True
17,B07XZHXZW4,HI MULTI PRO Alimento Premium para Perro Adulto 25kg. con probióticos y Proteínas de Alto Valor biológico,HI MULTI PRO,4.6,6546,1154.0,1000,亚马逊官方(上月购买量),2015-10-07,130,3,ALBAPESA,第三方(墨西哥),墨西哥,MX/36900/GUANAJUATO/PENJAMO/KM 63 CARRETERA IRAPUATO - LA PIEDAD,FBA,https://www.amazon.com.mx/dp/B07XZHXZW4,True
18,B003CL6Q84,"Hill's Science Diet Adult Small & Mini, Croquetas para Perro Adulto de Razas Pequeñas Sabor Pollo 7kg, Alimento para Perro, Ayuda a Construir Las Bases para la Salud a Largo Plazo, Piel y Pelaje",Hill's Science Diet,4.8,25355,960.0,1000,亚马逊官方(上月购买量),2013-07-08,157,2,Amazon México,亚马逊自营,,,亚马逊自营配送,https://www.amazon.com.mx/dp/B003CL6Q84,True
19,B01FKNX3FU,"Ganador Adulto, Razas Pequeñas, 20 kg, Azul",Ganador,4.8,1529,678.0,2000,亚马逊官方(上月购买量),2016-11-24,116,1,Amazon México,亚马逊自营,,,亚马逊自营配送,https://www.amazon.com.mx/dp/B01FKNX3FU,True
20,B0B1W1ZZGQ,"Churu Inaba, Premios Cremosos para Gato, Mix 4 Sabores de Atún, Bajos en Calorías, 50 Tubos de 14g",INABA,4.9,1527,675.0,2000,亚马逊官方(上月购买量),2023-10-29,33,18,Amazon México,亚马逊自营,,,亚马逊自营配送,https://www.amazon.com.mx/dp/B0B1W1ZZGQ,True
21,B0CF4BLG83,"Dogelthy Mobility. Suplemento Condroprotector para Perros con Glucosamina, Condroitina y Colageno Tipo 2 UCII en Polvo. Complemento para Croquetas o Dieta Barf 270g. (Pescado)",Dogelthy,4.6,2094,824.25,1000,亚马逊官方(上月购买量),2023-08-09,35,4,Dogelthy,品牌方(墨西哥),墨西哥,MX/45019/JALISCO/Zapopan/San Juan de Ocotan/5 de Mayo #15 Interior 6,FBA,https://www.amazon.com.mx/dp/B0CF4BLG83,True
22,B09R916GQ3,Purina Beneful Adulto Original Sabor Carne 10Kg,WeTap,4.8,2649,553.0,2000,亚马逊官方(上月购买量),2022-01-26,54,1,Amazon México,亚马逊自营,,,亚马逊自营配送,https://www.amazon.com.mx/dp/B09R916GQ3,True
23,B0BBSG79MX,"Pedigree - High Protein Alimento para Perro Adulto, Sabor Res y Pollo, 24 Sobres, 85g c/u, con Proteína, Antioxidantes y Vitamina E",Pedigree,4.8,1149,223.6,2000,亚马逊官方(上月购买量),2022-08-24,47,1,Amazon México,亚马逊自营,,,亚马逊自营配送,https://www.amazon.com.mx/dp/B0BBSG79MX,True
24,B07TGKCWWP,Dry Pet PAÑALES CH P/PERRO - 12 PZ,Fancy Pets,4.5,1451,131.53,600,亚马逊官方(上月购买量),2019-06-25,85,4,Amazon México,亚马逊自营,,,亚马逊自营配送,https://www.amazon.com.mx/dp/B07TGKCWWP,True
25,B008OV91VQ,"Hill's Natural Jerky Mini Strips, Premios para Perro con Pollo Sin Conservadores 200G",Hill's,4.7,2153,135.0,400,亚马逊官方(上月购买量),2014-09-12,142,5,Amazon México,亚马逊自营,,,亚马逊自营配送,https://www.amazon.com.mx/dp/B008OV91VQ,True
26,B071HPBSHV,"Amazon Basics - Pañales para perro macho, paquete de 30, tamaño pequeño, envoltura desechable ultraabsorbente con ajuste seguro, a prueba de fugas y cómodo",Amazon Basics,4.5,32205,471.08,600,亚马逊官方(上月购买量),2017-10-23,105,4,Amazon México,亚马逊自营,,,亚马逊自营配送,https://www.amazon.com.mx/dp/B071HPBSHV,True
27,B01FVRF920,"Barkys 80136100614 Jerky Sticks Palitos de Carne 1 kg, 1 Pieza, Small",BARKYS,4.8,1562,199.0,2000,亚马逊官方(上月购买量),2016-05-19,122,1,Amazon México,亚马逊自营,,,亚马逊自营配送,https://www.amazon.com.mx/dp/B01FVRF920,True
28,B0GWHHR2P1,"Collar de Perro Táctico, Collar para Perro de Nailon Militar Grueso con Asa, Collares de Perro Hebilla de Metal Resistente Ajustable para Entrenamiento de Perros, Cómodo (Rosa, L)",DAQI,4.7,933,188.0,200,亚马逊官方(上月购买量),2022-04-03,52,15,CHIYING,第三方(中国),中国,CN/06000/广东省/龙岗区/深圳市/坂田街道万科城社区新天下百瑞达大厦四层401室,FBA,https://www.amazon.com.mx/dp/B0GWHHR2P1,True
29,B0153V44K2,"Nupec - Croquetas para Perros, Adulto, Sabor a Carne, 8 kg (Empaque puede variar)",Nupec,4.8,4015,1040.0,700,亚马逊官方(上月购买量),2015-09-01,131,3,Amikoo Peek,第三方(墨西哥),墨西哥,"MX/52927/Estado de Mexico/Atizapan de Zaragoza/Malinche 50, Col San Miguel Xochimanga",FBA,https://www.amazon.com.mx/dp/B0153V44K2,True
30,B0971C67PW,Purina Fancy Feast Petit Fillet Adulto Todos los Tamaños Sabor Carne 12pack de 85g,WeTap,4.7,415,198.0,1000,亚马逊官方(上月购买量),2021-06-10,61,1,Amazon México,亚马逊自营,,,亚马逊自营配送,https://www.amazon.com.mx/dp/B0971C67PW,True
31,B01FUDI7F6,"Nupec croquetas para Perros, Senior, presentación de 15 kg.",Nupec,4.8,5198,2032.49,1000,亚马逊官方(上月购买量),2016-05-18,122,3,Amazon México,亚马逊自营,,,亚马逊自营配送,https://www.amazon.com.mx/dp/B01FUDI7F6,True
32,B07PY5FGR1,"Cloralex Mascotas, Elimina Malos Olores 3.75 L",Cloralex,4.8,2477,85.0,1000,亚马逊官方(上月购买量),,,1,Amazon México,亚马逊自营,,,亚马逊自营配送,https://www.amazon.com.mx/dp/B07PY5FGR1,True
33,B0DF4TZZ82,"Dogelthy Patas de Pollo Deshidratadas 100% Naturales. Premio para Perros sin Conservadores ni Saborizantes Artificiales. Snacks para Perro. Treats para Cachorros, Adultos y Senior Bolsa con 10 Piezas.",Dogelthy,4.4,75,210.0,400,亚马逊官方(上月购买量),2024-08-23,23,5,Dogelthy,品牌方(墨西哥),墨西哥,MX/45019/JALISCO/Zapopan/San Juan de Ocotan/5 de Mayo #15 Interior 6,FBA,https://www.amazon.com.mx/dp/B0DF4TZZ82,True
34,B016C6EJ4S,"Amazon Basics Paños absorbentes para perros y cachorros, diseño de 5 capas sin filtraciones, secado rápido, para entrenamiento, 71 x 86 cm (extra grande), paquete de 40, azul y blanco",Amazon Basics,4.5,216935,492.92,400,亚马逊官方(上月购买量),2025-01-11,18,6,Amazon México,亚马逊自营,,,亚马逊自营配送,https://www.amazon.com.mx/dp/B016C6EJ4S,True
35,B0153V3ZEI,"Nupec croquetas para Perros, Cachorros, con Vitamina E y Selenio, presentación de 5 kg.",Nupec,4.8,9504,723.0,400,亚马逊官方(上月购买量),2015-09-01,131,5,Amazon México,亚马逊自营,,,亚马逊自营配送,https://www.amazon.com.mx/dp/B0153V3ZEI,True
36,B09Y1R1GWL,"Pedigree - Sobres para Perro, Raza Pequeña, Sabor Res en Filetes, con Ingredientes Naturales, Proteínas y Fibra, 24 Sobres, 100g c/u",Pedigree,4.8,901,225.25,600,亚马逊官方(上月购买量),2022-04-15,51,1,Amazon México,亚马逊自营,,,亚马逊自营配送,https://www.amazon.com.mx/dp/B09Y1R1GWL,True
37,B0B43X13C2,"Cama para Perro, Resistente, Confortable, con Relleno Suave, Medidas y Color a Elegir (Medium, Negra/Gris)",PETS APPAREL HILLS,4.6,10390,399.2,100,亚马逊官方(上月购买量),2022-06-14,49,50,I Jacket,第三方(墨西哥),墨西哥,MX/06090/Ciudad de Mexico/Cuauhtemoc/Nezahualcoyotl/158 Depto 202,FBA,https://www.amazon.com.mx/dp/B0B43X13C2,True
38,B09Z6QHGTG,"Cortauñas para perros y gatos con luz LED:ilumina uñas o línea de sangre para un corte seguro. Hojas extra afiladas para uñas gruesas, sensor rápido evita cortes excesivos. Ideal para perros y gatos.",Elvess,4.7,1695,195.65,1000,亚马逊官方(上月购买量),2022-04-29,51,1,elvess,品牌方(墨西哥),墨西哥,MX/518000/GUANGDONG/shenzhen/longgangqulongchengjiedaoailianshequjinhuajie73hao301,FBA,https://www.amazon.com.mx/dp/B09Z6QHGTG,True
39,B0BQTFBXHP,"Hill's Science Diet Small Bites, Croquetas para Perro Senior 7+ Bocados Pequeños Sabor Pollo Y Arroz Integral 6.8Kg",Hill's Science Diet,4.7,478,1152.0,1000,亚马逊官方(上月购买量),2022-12-22,43,1,Amazon México,亚马逊自营,,,亚马逊自营配送,https://www.amazon.com.mx/dp/B0BQTFBXHP,True
40,B08NWZD6MS,"Spring Blossoms - Rastrillo de aseo profesional 2 en 1 para gatos y perros, peine para quitar fácilmente las alfombrillas y los enredos, seguro para cepillo para mascotas (Naranja)",Spring Blossoms,4.7,4260,297.99,800,亚马逊官方(上月购买量),2021-01-06,67,4,GoodHappens,第三方(中国),中国,CN/361000/福建/厦门市/205-11室之三/火炬高新区软件园二期观日路8号,FBA,https://www.amazon.com.mx/dp/B08NWZD6MS,True
41,B0CK32S653,"Waggys Salmon Bites, Premios Naturales Sin Granos para Perros, 100 pzs",Waggys,4.6,639,189.0,1000,亚马逊官方(上月购买量),2023-09-28,34,2,Waggy´s!,品牌方(墨西哥),墨西哥,MX/44520/JALISCO/GUADALAJARA/LAZARO CARDENAS 3454,FBA,https://www.amazon.com.mx/dp/B0CK32S653,True
42,B075N8M4BQ,"Cesar - Sobres de Alimento para Perro, Sabor Filete Mignon en su Jugo, 24 Sobres, 75 gr. c/u",Cesar,4.7,795,220.0,500,亚马逊官方(上月购买量),2017-09-11,106,4,Amazon México,亚马逊自营,,,亚马逊自营配送,https://www.amazon.com.mx/dp/B075N8M4BQ,True
43,B0723HRWJW,"Nature's Miracle - Eliminador de Manchas y Olores de Perros - 946 ml - Fórmula Avanzada - Limpia las Manchas más Difíciles - Neutraliza Olores - Apto para Muebles, Alfombras, Suelos Duros y Tejidos",Nature's Miracle,4.4,23276,224.25,1000,亚马逊官方(上月购买量),2017-06-29,109,3,Amazon México,亚马逊自营,,,亚马逊自营配送,https://www.amazon.com.mx/dp/B0723HRWJW,True
44,B01M8G9HYE,"Nupec PENU7138 - AAAAAA Premio para Perros Relax, 180 Gr (El empaque puede variar)",Nupec,4.6,5432,101.7,1000,亚马逊官方(上月购买量),2016-11-02,117,1,Amazon México,亚马逊自营,,,亚马逊自营配送,https://www.amazon.com.mx/dp/B01M8G9HYE,True
45,B0F96F3XWF,"King Dog & Cat Tapetes Entrenadores para Perros Clean Pet, 40 Piezas, 60 x 60 cm, 6 Capas Máxima Absorción e Higiene para Perros",King Dog & Cat,4.7,9,285.0,900,亚马逊官方(上月购买量),,,1,Zeitex,第三方(墨西哥),墨西哥,MX/52764/MEXICO/HUIXQUILUCAN DE DEGOLLADO/AVENIDA JESUS DEL MONTE 39 PISO 2B JESUS DEL MONTE,FBA,https://www.amazon.com.mx/dp/B0F96F3XWF,True
46,B01FUDI7OC,"Nupec alimento para Perros, Weight Control, nutrición para Perros con sobrepeso u obesidad, presentación de 15 kg.",Nupec,4.8,3937,2266.15,1000,亚马逊官方(上月购买量),2016-05-18,122,3,Amazon México,亚马逊自营,,,亚马逊自营配送,https://www.amazon.com.mx/dp/B01FUDI7OC,True
47,B0B84V22ZJ,"RENDIN 255 Bolsas para Perro Biodegradables,Prueba de Fugas y Fragante Bolsitas para Perro,17 Rollos + 1 Dispensador+1 Clip",RENDIN,4.8,1754,199.0,600,亚马逊官方(上月购买量),,,4,L-JL,第三方(中国),中国,"CN/518129/Guangdong/Longgang/shenzhen/Room 203, Building 21/The Third Industrial Zone, Bantian Community, Bantian Street",FBA,https://www.amazon.com.mx/dp/B0B84V22ZJ,True
48,B0088LIINY,"Earth Rated - Bolsas para excremento de perros, 120 bolsas en 8 rollos con olor a lavanda",Earth Rated,4.9,200805,165.0,900,亚马逊官方(上月购买量),,,4,Amazon México,亚马逊自营,,,亚马逊自营配送,https://www.amazon.com.mx/dp/B0088LIINY,True
49,B0DL98VSFP,"540 Bolsas para Popo de Perro Biodegradables en 36 Rollos con Dispensador y Clip, Bolsas para Desechos de Mascotas, Bolsas para Excremento de Perros Portátil, Olor a Lavanda",ESRAIN,4.8,302,242.1,700,亚马逊官方(上月购买量),,,1,ESRAIN,品牌方(中国),中国,CN/518108/广东/宝安区/深圳市/金凯进厂区厂房一C403/石岩街道石龙社区,FBA,https://www.amazon.com.mx/dp/B0DL98VSFP,True
50,B08B2LSSTL,Medical Solutions Fancy Pets MS Collar Isabelino Ajustable para Perros y Gatos – Protección Postoperatoria para Evitar Lamer y Rascar Heridas – Talla 7 (46 cm),Fancy Pets,4.5,3046,149.0,50,亚马逊官方(上月购买量),2020-06-11,73,11,Amazon México,亚马逊自营,,,亚马逊自营配送,https://www.amazon.com.mx/dp/B08B2LSSTL,True
51,B0CDYWTMRM,Purina Dog Chow Adulto Todos los tamaños Sabor Carne y Pollo 18Kg,Dog Chow,4.7,549,720.0,500,亚马逊官方(上月购买量),2023-08-07,36,1,Amazon México,亚马逊自营,,,亚马逊自营配送,https://www.amazon.com.mx/dp/B0CDYWTMRM,True
52,B0855ND74T,"PetLovers Set de 600 Hojas Quita Pelusa para Ropa - Rodillo Quita Pelusa Extra Pegajoso, Rodillo Quita Pelos de Mascotas - Pack De 6",PetLovers,4.8,357,364.04,300,亚马逊官方(上月购买量),,,4,PetLovers MX,品牌方(美国),美国,US/33702/FL/SAINT PETERSBURG/7901 4th ST N STE 300,FBA,https://www.amazon.com.mx/dp/B0855ND74T,True
53,B07L9JHXJR,"Taste Of The Wild - Alimento seco para perros Pacific Stream Premium, sin cereales, rico en proteínas",Taste Of The Wild,4.7,6607,1610.0,900,亚马逊官方(上月购买量),2019-01-30,90,1,Amazon México,亚马逊自营,,,亚马逊自营配送,https://www.amazon.com.mx/dp/B07L9JHXJR,True
54,B0CG34P974,"Pechera Arnés De Seguridad para Perro Chico Mediano Y Grande con Correa 1.5m (Fuscia, L)",UNA MASCOTA,4.6,1287,219.0,50,亚马逊官方(上月购买量),2023-08-19,35,63,COMERSTAT,第三方,,,FBA,https://www.amazon.com.mx/dp/B0CG34P974,True
55,B0155E0168,Fancy Pets Plato de Acero Inoxidable para Perro con 8 Onzas o 227 Gramos,Fancy Pets,4.7,6649,40.5,700,亚马逊官方(上月购买量),2016-01-22,126,7,Amazon México,亚马逊自营,,,亚马逊自营配送,https://www.amazon.com.mx/dp/B0155E0168,True
56,B08WLPDWV6,"Barkys Biscuit premios para Perro con Omega 3 Y 6, 2.5 kg",Cowjag,4.8,969,282.0,1000,亚马逊官方(上月购买量),2021-02-15,65,1,Amazon México,亚马逊自营,,,亚马逊自营配送,https://www.amazon.com.mx/dp/B08WLPDWV6,True
57,B0FN2WXY5M,"270 Bolsas para Popo de Perro Biodegradables en 18 Rollos con Dispensador y Clip, Bolsas para Desechos de Mascotas, Bolsas para Excremento de Perros Portátil, Olor a Lavanda",ESRAIN,4.8,88,157.5,300,亚马逊官方(上月购买量),,,1,ESRAIN,品牌方(中国),中国,CN/518108/广东/宝安区/深圳市/金凯进厂区厂房一C403/石岩街道石龙社区,FBA,https://www.amazon.com.mx/dp/B0FN2WXY5M,True
58,B00EJXIZ60,"Earth Rated - Bolsas para excremento de perros, 120 bolsas en 8 rollos sin olor",Earth Rated,4.9,16948,134.25,1000,亚马逊官方(上月购买量),2014-02-23,149,1,Amazon México,亚马逊自营,,,亚马逊自营配送,https://www.amazon.com.mx/dp/B00EJXIZ60,True
59,B0BKK5XWDL,"Raganet, Maleta Transportadora de Mascotas, Perros y Gatos, Bolsa Portátil para Máximo 10Kg de Peso, Medidas: 42cm Largo X 20cm Ancho X 25cm Altura, Mochila para Viajes y Auto Color Rosa",Raganet,4.6,1247,178.99,300,亚马逊官方(上月购买量),2022-10-26,45,3,Raga Basics,第三方(墨西哥),墨西哥,MX/52790/MEXICO/HUIXQUILUCAN DE DEGOLLADO/Dos Rios/Avenida Vicente Guerrero,FBA,https://www.amazon.com.mx/dp/B0BKK5XWDL,True
60,B09KQVCC67,Nature's Miracle Destructor de Orina Plus Perro 946 ml,Nature's Miracle,4.4,4250,239.25,800,亚马逊官方(上月购买量),2021-11-01,57,3,Amazon México,亚马逊自营,,,亚马逊自营配送,https://www.amazon.com.mx/dp/B09KQVCC67,True
61,B0DQ6D53RJ,Dogelthy Gastro Aid. Pre + Probioticos con +3 Billones de UFC x Scoop. Suplemento para Perros. Complemento para Croquetas o Dieta Barf de 270g (Cerdo),Dogelthy,4.5,83,641.0,400,亚马逊官方(上月购买量),2023-08-09,35,4,Dogelthy,品牌方(墨西哥),墨西哥,MX/45019/JALISCO/Zapopan/San Juan de Ocotan/5 de Mayo #15 Interior 6,FBA,https://www.amazon.com.mx/dp/B0DQ6D53RJ,True
62,B0153V47YU,"Nupec croquetas para Perros, Cachorros Razas pequeñas, con Vitamina E y Selenio, presentación de 2 kg.",Nupec,4.8,3167,401.0,1000,亚马逊官方(上月购买量),2015-10-06,130,1,Amazon México,亚马逊自营,,,亚马逊自营配送,https://www.amazon.com.mx/dp/B0153V47YU,True
63,B0CN7CRSLH,"Raganet, Cubierta para Mascotas, Funda Cubre Asientos de Autos, Sillones. Ideal para Perros y Gatos, para Asiento Trasero, Cajuela o Sofa, Medidas: 137 * 147 * 40cm Impermeable (Negra Completa)",Raganet,4.3,1675,269.0,600,亚马逊官方(上月购买量),,,2,Raga Basics,第三方(墨西哥),墨西哥,MX/52790/MEXICO/HUIXQUILUCAN DE DEGOLLADO/Dos Rios/Avenida Vicente Guerrero,FBA,https://www.amazon.com.mx/dp/B0CN7CRSLH,True
64,B0CW618SPM,"Puerta de Seguridad, Puerta para Bebés, 76-125 cm, Puerta para Perros/Mascotas, Puerta de Seguridad para Niños, Sin Perforación, para Escale",MOXIMX,4.7,247,1081.5,500,亚马逊官方(上月购买量),,,2,duanyuUS,第三方(中国),中国,CN/422700/湖南省/新宁县/邵阳市/金石镇河边街37号,FBA,https://www.amazon.com.mx/dp/B0CW618SPM,True
65,B09232RF2N,PERFECT SENSE SENIOR 3 KG,Perfect Sense,4.7,717,429.0,400,亚马逊官方(上月购买量),2019-09-17,82,3,Amazon México,亚马逊自营,,,亚马逊自营配送,https://www.amazon.com.mx/dp/B09232RF2N,True
66,B0D7XPXCSL,"Tapo - Cámara de Seguridad Interior TP-Link 2K con función panorámica/inclinación para Monitor de bebé, Mascotas, detección de Movimiento, Audio bidireccional, Almacenamiento, Negra, C211, 2 Piezas",Tapo,4.7,3132,776.65,500,亚马逊官方(上月购买量),,,2,Amazon Estados Unidos,亚马逊自营,,,亚马逊自营配送,https://www.amazon.com.mx/dp/B0D7XPXCSL,True
67,B07PSK15Y2,Nupec Alimento Seco para Perro Raza Pequeña Senior - 1 x 8 kg,Nupec,4.8,4257,1548.0,1000,亚马逊官方(上月购买量),2019-03-18,88,1,Ros Pet-Shop,第三方(墨西哥),墨西哥,MX/72220/PUEBLA/HEROICA PUEBLA DE ZARAGOZA/MARAVILLAS/calle c num 24 PARQUE INDUSTRIAL PUEBLA 2000,FBA,https://www.amazon.com.mx/dp/B07PSK15Y2,True
68,B07NSD6XW3,"Nupec Alimento Seco para Perro Raza Pequeña Senior, 2 kg, 1 Pack",Nupec,4.9,2269,487.0,1000,亚马逊官方(上月购买量),2019-03-18,88,1,Amazon México,亚马逊自营,,,亚马逊自营配送,https://www.amazon.com.mx/dp/B07NSD6XW3,True
69,B01FKNX4R2,Ganador Cachorro Todas las Razas Alimento Seco - 1 x 20 kg,Ganador,4.7,1150,718.0,900,亚马逊官方(上月购买量),2016-11-24,116,1,Amazon México,亚马逊自营,,,亚马逊自营配送,https://www.amazon.com.mx/dp/B01FKNX4R2,True
70,B0B45BW58F,"Raganet, Mochila Transportadora de Mascotas, Perros y Gatos, Back Pack Portátil para Mascota Pequeña (Máximo 7Kg) Medidas: Ancho 23cm Largo 33cm Altura 42cm (Color Negro)",Raganet,4.6,3072,298.0,700,亚马逊官方(上月购买量),2022-06-15,49,3,Raga Basics,第三方(墨西哥),墨西哥,MX/52790/MEXICO/HUIXQUILUCAN DE DEGOLLADO/Dos Rios/Avenida Vicente Guerrero,FBA,https://www.amazon.com.mx/dp/B0B45BW58F,True
71,B0GQ68VD9R,Fancy Pets Kit Dental Progresivo para Perro con Pasta Dental Comestible 90 g (3.17 oz) y Dedales Incluye Cepillo Doble Cabezal Higiene Bucal Canina 4 Piezas,Fancy Pets,4.7,51,119.0,1000,亚马逊官方(上月购买量),2026-02-25,5,1,Amazon México,亚马逊自营,,,亚马逊自营配送,https://www.amazon.com.mx/dp/B0GQ68VD9R,True
72,B07ZV7G6Y6,Purina Beneful Adulto Raza Minis y Pequeñas Sabor Carne y Arroz 20pack de 100g,WeTap,4.7,1497,270.18,600,亚马逊官方(上月购买量),2019-10-31,81,1,Amazon México,亚马逊自营,,,亚马逊自营配送,https://www.amazon.com.mx/dp/B07ZV7G6Y6,True
73,B018TYLZU2,Fancy Pets Tapete de Entrenamiento para Perros Doggie Grass GDE | Pasto Sintético con Bandeja y Rejilla | Control de Olores y Fácil Limpieza,Fancy Pets,4.4,10071,529.0,600,亚马逊官方(上月购买量),2015-12-02,128,3,Amazon México,亚马逊自营,,,亚马逊自营配送,https://www.amazon.com.mx/dp/B018TYLZU2,True
74,B07X148WCW,Purina One Adulto Raza Mediana y Grande Sabor Pollo y Carne 7Kg,WeTap,4.6,733,499.33,700,亚马逊官方(上月购买量),2019-08-29,83,1,Amazon México,亚马逊自营,,,亚马逊自营配送,https://www.amazon.com.mx/dp/B07X148WCW,True
75,B0H46Y7Q4H,"LUDOS Toallitas Húmedas, Uso Diario para Perro y Gato, con Aloe Vera y Vitamina E, Paquete con 80 Piezas. (Paquete de 2)",LUDOS,4.7,500,98.0,,,2023-12-06,32,2,Amazon México,亚马逊自营,,,亚马逊自营配送,https://www.amazon.com.mx/dp/B0H46Y7Q4H,True
76,B07WZ2KN1V,Cloralex Mascotas Elimina Malos Olores 10 L,Cloralex,4.8,936,238.35,900,亚马逊官方(上月购买量),,,1,Amazon México,亚马逊自营,,,亚马逊自营配送,https://www.amazon.com.mx/dp/B07WZ2KN1V,True
77,B0F5Y4GWD6,"MAGMALIFE Tapete Entrenador para Perro 60 x 60 cm, 50 Almohadillas Desechables para Mascota Súper Absorbentes Antifugas, Pañales de Entrenamiento con Control de Olores y Secado Rápido (Azul)",MAGMALIFE,4.4,8,245.0,100,亚马逊官方(上月购买量),,,2,Zavix Brands,第三方(墨西哥),墨西哥,MX/11500/Miguel Hidalgo/CDMX/Int. 504/Presa Salinillas 370,FBA,https://www.amazon.com.mx/dp/B0F5Y4GWD6,True
78,B074M2D1LJ,"Perfect Sense Alimento Premium para Perro Adulto Raza Mediana y Grande MLB 15 kg - 100% Natural con Omega 3, Prebióticos y Antioxidantes - Alta Digestibilidad",Perfect Sense,4.6,737,1549.0,500,亚马逊官方(上月购买量),2017-08-06,108,3,Amazon México,亚马逊自营,,,亚马逊自营配送,https://www.amazon.com.mx/dp/B074M2D1LJ,True
79,B01FVRFC7W,"Barkys Bacon Waves Tocinitos Botana para Perros, 567 gr",BARKYS,4.8,759,191.0,700,亚马逊官方(上月购买量),2016-05-19,122,1,Amazon México,亚马逊自营,,,亚马逊自营配送,https://www.amazon.com.mx/dp/B01FVRFC7W,True
80,B096N1C82L,Purina One Adulto Raza Minis y Pequeños Sabor Pollo y Carne 3.5Kg,Purina One Dry Perro,4.6,251,257.3,500,亚马逊官方(上月购买量),2021-06-04,62,1,Amazon México,亚马逊自营,,,亚马逊自营配送,https://www.amazon.com.mx/dp/B096N1C82L,True
81,B0BRJV1W44,Limpiador Enzimático Destructor De Orina 4L | Elimina Manchas y Olores De Mascotas | Seguro Para Hogar y Superficies | Limpieza Profunda Sin Cloro Ni Tóxicos | Fórmula Avanzada,Alamazonas,4.2,105,549.0,500,亚马逊官方(上月购买量),,,4,MERCHTONCOM,第三方(墨西哥),墨西哥,MX/45615/JALISCO/TLAQUEPAQUE/65/JESUS RAMIREZ,FBA,https://www.amazon.com.mx/dp/B0BRJV1W44,True
82,B08QJNMHLZ,"Arm & Hammer Complete Care Dog Dental Kit | 2.5 oz Chicken Flavor Enzymatic Dog Toothpaste, Toothbrush, & Finger Brush | Baking Soda Enhanced Formula for Fresh Breath and Tartar Control",Arm & Hammer,4.6,3168,125.0,500,亚马逊官方(上月购买量),,,1,Amazon México,亚马逊自营,,,亚马逊自营配送,https://www.amazon.com.mx/dp/B08QJNMHLZ,True
